{
  "schema_version": "debark.snapshot/v1",
  "created_at": "2026-09-06T22:01:25Z",
  "tool": {
    "name": "debark",
    "version": "dev",
    "edition": "community"
  },
  "target": {
    "distro_id": "ubuntu",
    "version_id": "24.04",
    "codename": "noble",
    "arch": "amd64",
    "apt_version": "2.8.3",
    "dpkg_version": "1.22.6"
  },
  "apt": {
    "sources": [
      {
        "path": "/etc/apt/sources.list.d/ubuntu.sources",
        "archive_path": "etc/apt/sources.list.d/ubuntu.sources",
        "size": 381,
        "sha256": "f8b543825ff12ee4f229cb92d570481e04480ee427f18d95128c952c533769a5",
        "mode": "0644"
      }
    ],
    "keyrings": [
      {
        "path": "/usr/share/keyrings/ubuntu-archive-keyring.gpg",
        "archive_path": "usr/share/keyrings/ubuntu-archive-keyring.gpg",
        "size": 3607,
        "sha256": "80a36b0a6de2f69f49d2df75ef473ccde121e9e190b9ea01d20a4f63778d5c31",
        "mode": "0644"
      }
    ]
  },
  "dpkg_status": {
    "path": "/var/lib/dpkg/status",
    "archive_path": "var/lib/dpkg/status",
    "size": 14250,
    "sha256": "aa89ffaf58115dc496175ceffae4702bd9987939676cd710731ef693816b4ae7",
    "mode": "0644"
  },
  "origin": {
    "kind": "synthesized",
    "base_id": "ubuntu:24.04/minimal",
    "source": "builtin",
    "source_digest": "17f29a9e4d5fc4ec5af8dddf9736d3123cc190ddc7f324b026b031acc0eb2531",
    "assumed_installed": [
      "adduser:all",
      "apt-utils:amd64",
      "apt:amd64",
      "console-setup-linux:all",
      "console-setup:all",
      "debconf-i18n:all",
      "debconf:all",
      "dhcpcd-base:amd64",
      "distro-info-data:all",
      "distro-info:amd64",
      "dpkg:amd64",
      "e2fsprogs:amd64",
      "eject:amd64",
      "ethtool:amd64",
      "gcc-14-base:amd64",
      "gpgv:amd64",
      "init-system-helpers:all",
      "init:amd64",
      "iproute2:amd64",
      "iputils-ping:amd64",
      "kbd:amd64",
      "keyboard-configuration:all",
      "kmod:amd64",
      "less:amd64",
      "libacl1:amd64",
      "libapparmor1:amd64",
      "libapt-pkg6.0t64:amd64",
      "libargon2-1:amd64",
      "libassuan0:amd64",
      "libaudit-common:all",
      "libaudit1:amd64",
      "libblkid1:amd64",
      "libbpf1:amd64",
      "libbsd0:amd64",
      "libbz2-1.0:amd64",
      "libc-bin:amd64",
      "libc6:amd64",
      "libcap-ng0:amd64",
      "libcap2-bin:amd64",
      "libcap2:amd64",
      "libcom-err2:amd64",
      "libcrypt1:amd64",
      "libcryptsetup12:amd64",
      "libdb5.3t64:amd64",
      "libdevmapper1.02.1:amd64",
      "libelf1t64:amd64",
      "libexpat1:amd64",
      "libext2fs2t64:amd64",
      "libfdisk1:amd64",
      "libffi8:amd64",
      "libgcc-s1:amd64",
      "libgcrypt20:amd64",
      "libglib2.0-0t64:amd64",
      "libgmp10:amd64",
      "libgnutls30t64:amd64",
      "libgpg-error0:amd64",
      "libhogweed6t64:amd64",
      "libidn2-0:amd64",
      "libjson-c5:amd64",
      "libkmod2:amd64",
      "liblocale-gettext-perl:amd64",
      "liblz4-1:amd64",
      "liblzma5:amd64",
      "libmd0:amd64",
      "libmnl0:amd64",
      "libmount1:amd64",
      "libncursesw6:amd64",
      "libnetplan1:amd64",
      "libnettle8t64:amd64",
      "libnewt0.52:amd64",
      "libnpth0t64:amd64",
      "libp11-kit0:amd64",
      "libpam-modules-bin:amd64",
      "libpam-modules:amd64",
      "libpam0g:amd64",
      "libpcre2-8-0:amd64",
      "libpopt0:amd64",
      "libproc2-0:amd64",
      "libpython3-stdlib:amd64",
      "libpython3.12-minimal:amd64",
      "libpython3.12-stdlib:amd64",
      "libreadline8t64:amd64",
      "libseccomp2:amd64",
      "libselinux1:amd64",
      "libsemanage-common:all",
      "libsemanage2:amd64",
      "libsepol2:amd64",
      "libslang2:amd64",
      "libsmartcols1:amd64",
      "libsqlite3-0:amd64",
      "libss2:amd64",
      "libssl3t64:amd64",
      "libstdc++6:amd64",
      "libsystemd-shared:amd64",
      "libsystemd0:amd64",
      "libtasn1-6:amd64",
      "libtext-charwidth-perl:amd64",
      "libtext-iconv-perl:amd64",
      "libtext-wrapi18n-perl:all",
      "libtinfo6:amd64",
      "libudev1:amd64",
      "libunistring5:amd64",
      "libuuid1:amd64",
      "libxtables12:amd64",
      "libxxhash0:amd64",
      "libyaml-0-2:amd64",
      "libzstd1:amd64",
      "locales:all",
      "logsave:amd64",
      "lsb-release:all",
      "mawk:amd64",
      "media-types:all",
      "mount:amd64",
      "netbase:all",
      "netcat-openbsd:amd64",
      "netplan-generator:amd64",
      "netplan.io:amd64",
      "passwd:amd64",
      "perl-base:amd64",
      "procps:amd64",
      "python-apt-common:all",
      "python3-apt:amd64",
      "python3-cffi-backend:amd64",
      "python3-minimal:amd64",
      "python3-netplan:amd64",
      "python3-pkg-resources:all",
      "python3-yaml:amd64",
      "python3.12-minimal:amd64",
      "python3.12:amd64",
      "python3:amd64",
      "readline-common:all",
      "sensible-utils:all",
      "sudo:amd64",
      "systemd-dev:all",
      "systemd-sysv:amd64",
      "systemd:amd64",
      "tar:amd64",
      "tzdata:all",
      "ubuntu-keyring:all",
      "ubuntu-minimal:amd64",
      "ubuntu-pro-client:amd64",
      "udev:amd64",
      "vim-common:all",
      "vim-tiny:amd64",
      "whiptail:amd64",
      "xkb-data:all",
      "zlib1g:amd64"
    ]
  },
  "installed_count": 147,
  "keyring_fingerprints": [
    {
      "fingerprint": "790BC7277767219C42C86F933B4FE6ACC0B21F32",
      "key_id": "3B4FE6ACC0B21F32",
      "user_ids": [
        "Ubuntu Archive Automatic Signing Key (2012) \u003cftpmaster@ubuntu.com\u003e"
      ],
      "keyring": "/usr/share/keyrings/ubuntu-archive-keyring.gpg"
    },
    {
      "fingerprint": "843938DF228D22F7B3742BC0D94AA3F0EFE21092",
      "key_id": "D94AA3F0EFE21092",
      "user_ids": [
        "Ubuntu CD Image Automatic Signing Key (2012) \u003ccdimage@ubuntu.com\u003e"
      ],
      "keyring": "/usr/share/keyrings/ubuntu-archive-keyring.gpg"
    },
    {
      "fingerprint": "F6ECB3762474EDA9D21B7022871920D1991BC93C",
      "key_id": "871920D1991BC93C",
      "user_ids": [
        "Ubuntu Archive Automatic Signing Key (2018) \u003cftpmaster@ubuntu.com\u003e"
      ],
      "keyring": "/usr/share/keyrings/ubuntu-archive-keyring.gpg"
    }
  ],
  "warnings": [
    "this snapshot was synthesized from a base definition, not captured from a real machine: the bundle built from it is complete only if the target really is a stock install of this release"
  ]
}
